{
  "mode": "full_package",
  "job": {
    "job_id": "weavegrid-head-of-gtm-sf-2026-02-20",
    "source_url": "https://www.linkedin.com/jobs/view/head-of-go-to-market-gtm-at-weavegrid-4319927484",
    "company": "WeaveGrid",
    "role_title": "Head of Go-to-Market (GTM)",
    "location": "San Francisco, CA",
    "job_description": "",
    "must_have_keywords": [
      "GTM leadership",
      "go-to-market strategy",
      "cross-functional alignment",
      "execution systems",
      "stakeholder management"
    ],
    "nice_to_have_keywords": [
      "technical translation",
      "process design",
      "launch operations",
      "content and narrative strategy"
    ]
  },
  "candidate": {
    "name": "Melissa Leavenworth",
    "contact": {
      "email": "mlleavenworth@gmail.com",
      "phone": "720-585-5238",
      "linkedin": "https://www.linkedin.com/in/melissaleavenworth/",
      "portfolio": "",
      "location": "San Francisco Bay Area"
    },
    "master_resume_dataset": {
      "file_ref": "memory/master_resume.md",
      "notes": "Use as the sole source of factual claims and metrics."
    }
  },
  "constraints": {
    "no_invented_metrics": true,
    "banned_phrases": [
      "sits at the intersection of",
      "scrappy"
    ],
    "format": "markdown_ats",
    "resume_page_limit": 1
  },
  "revision_request": {
    "scope": "none",
    "notes": ""
  }
}
